El Pomar Foundation,2010,Heart of Colorado,Lake,"Advocates of Lake County, Inc.",50000.00,Leadville,Program,"Housing, Homeless shelters",El Pomar Foundation,2010,Heart of Colorado,Park,Gold Belt Tour Scenic and Historic Byway Association,5000.00,Guffey,Capital,"Community, Public Affairs",El Pomar Foundation,2010,Heart of Colorado,Park,Lake George Fire Protection District,2500.00,Lake George,Other,"Public safety, Emergency relief",El Pomar Foundation,2010,Heart of Colorado,Park,Park County Vision 2020,2500.00,Fairplay,Program,Emergency Assistance      ,El Pomar Foundation,2010,Heart of Colorado,Park,Park County Senior Coalition,2500.00,Fairplay,Program,Emergency Assistance      ,El Pomar Foundation,2010,Heart of Colorado,Park,South Park Food Bank,7500.00,Fairplay,Program,Emergency Assistance      ,El Pomar Foundation,2010,Heart of Colorado,Park,Boys and Girls Club of South Park,15000.00,Salida,Program,Health                                                                     ,El Pomar Foundation,2010,Heart of Colorado,Park,Park County Search and Rescue,1500.00,Bailey,General Operating,"Public safety, Emergency relief",El Pomar Foundation,2010,Heart of Colorado,Park,Rocky Mountain Rural Health,12500.00,Fairplay,Program,Health                                                                     ,El Pomar Foundation,2010,Heart of Colorado,Park,Rocky Mountain Rural Health,10000.00,Fairplay,General Operating,Health                                                                     ,El Pomar Foundation,2010,Heart of Colorado,Summit,Lake Dillon Foundation for the Performing Arts,7500.00,Dillon,General Operating,"Arts, Culture & Humanities ",El Pomar Foundation,2010,Heart of Colorado,Summit,Breckenridge Outdoor Education Center,7500.00,Breckenridge,Program,Education,El Pomar Foundation,2010,Heart of Colorado,Summit,"Advocates for Victims of Assault, Inc.",5000.00,Frisco,General Operating,"Domestic Violence Shelters, Services",El Pomar Foundation,2010,Heart of Colorado,Summit,"Early Intervention Colorado of Summit County, Inc.",2500.00,Frisco,Program,Human Services,El Pomar Foundation,2010,Heart of Colorado,Summit,Family Wellness Center,1500.00,Frisco,Program,Human Services,El Pomar Foundation,2010,Heart of Colorado,Summit,Keystone Center,7500.00,Keystone,General Operating,Education,El Pomar Foundation,2010,Heart of Colorado,Summit,Dillon Community Church,1000.00,Dillon,Program,Human Services,El Pomar Foundation,2010,Heart of Colorado,Summit,Father Dyer United Methodist Church,1000.00,Breckenridge,Program,Human Services,El Pomar Foundation,2010,Heart of Colorado,Summit,"Summit County Community Care Clinic, Inc.",7000.00,Frisco,Program,Health                                                                     ,El Pomar Foundation,2010,Heart of Colorado,Summit,Summit County Family Resource Center,6000.00,Dillon,Program,Human Services,El Pomar Foundation,2010,Heart of Colorado,Summit,"Summit County Care Clinic, Inc.",1500.00,Frisco,General Operating,Health                                                                     ,El Pomar Foundation,2010,Heart of Colorado,Summit,"Summit County Care Clinic, Inc.",1500.00,Frisco,General Operating,Health                                                                     ,El Pomar Foundation,2010,Heart of Colorado,Summit,"Summit Radio and TV, Inc.",1500.00,Breckenridge,General Operating,"Community, Public Affairs",El Pomar Foundation,2010,Heart of Colorado,Teller,Teller Senior Coalition,5000.00,Woodland Park,General Operating,Human Services,El Pomar Foundation,2010,Heart of Colorado,Teller,Feline Friends of the Pikes Peak Region,3900.00,Florissant,General Operating,Animal Protection and Welfare,El Pomar Foundation,2010,Heart of Colorado,Teller,Little Chapel of the Hills,5000.00,Divide,Program,Human Services,El Pomar Foundation,2010,Heart of Colorado,Teller,Teller County Safe House,5000.00,Woodland Park,Program,"Domestic Violence Shelters, Services",El Pomar Foundation,2010,Heart of Colorado,Teller,Teller Senior Coalition,5000.00,Woodland Park,Program,Human Services,El Pomar Foundation,2010,Heart of Colorado,Teller,"Woodland Park Community Cupboard, inc.",2500.00,Woodland Park,Program,Human Services,El Pomar Foundation,2010,Heart of Colorado,Teller,Cripple Creek Victor High School,5000.00,Cripple Creek,Other,Education,El Pomar Foundation,2010,Northeast,Cheyenne,Cheyenne County Public Health,2200.00,Cheyenne Wells,Program,Health                                                                     ,El Pomar Foundation,2010,Northeast,Cheyenne,Prairie View Health Resources ,1500.00,Cheyenne Wells,General Operating,Health                                                                     ,El Pomar Foundation,2010,Northeast,Kit Carson,"Dynamic Dimensions, Inc.",10000.00,Burlington,Capital,Disabled Persons,El Pomar Foundation,2010,Northeast,Logan,Logan County Literacy Coalition,2500.00,Sterling,General Operating,Education,El Pomar Foundation,2010,Northeast,Logan,Cooperating Ministries of Logan County,14000.00,Sterling,Program,Emergency Assistance      ,El Pomar Foundation,2010,Northeast,Logan,Help for Abused Partners,5000.00,Sterling,Program,"Domestic Violence Shelters, Services",El Pomar Foundation,2010,Northeast,Logan,Family Resource Center,1500.00,Sterling,General Operating,,El Pomar Foundation,2010,Northeast,Logan,Northeast Colorado Health Department,13000.00,Sterling,Program,Health                                                                     ,El Pomar Foundation,2010,Northeast,Logan,Northeastern Junior College Foundation,7500.00,Sterling,Student Aid/Scholarship,Education,El Pomar Foundation,2010,Northeast,Logan,Northeastern Junior College Foundation,5000.00,Sterling,Program,Education,El Pomar Foundation,2010,Northeast,Morgan,High Plains Sexual Assault Center,5000.00,Fort Morgan,General Operating,"Domestic Violence Shelters, Services",El Pomar Foundation,2010,Northeast,Morgan,Morgan County Family Center,5000.00,Fort Morgan,General Operating,Human Services,El Pomar Foundation,2010,Northeast,Morgan,"Caring Ministries of Morgan County, Inc.",14000.00,Fort Morgan,Program,Emergency Assistance      ,El Pomar Foundation,2010,Northeast,Morgan,"SHARE, Inc",5000.00,Fort Morgan,Program,"Domestic Violence Shelters, Services",El Pomar Foundation,2010,Northeast,Morgan,Morgan Community College Foundation,7500.00,Fort Morgan,Student Aid/Scholarship,Education,El Pomar Foundation,2010,Northeast,Morgan,Morgan Community College Foundation,5000.00,Fort Morgan,Program,Education,El Pomar Foundation,2010,Northeast,Morgan,Northeastern Colorado Association of Local Governments,1500.00,Fort Morgan,Program,Human Services,El Pomar Foundation,2010,Northeast,Morgan,OneMorgan County,1500.00,Fort Morgan,Program,"Community, Public Affairs",El Pomar Foundation,2010,Northeast,Morgan,OneMorgan County,1500.00,Fort Morgan,General Operating,"Community, Public Affairs",El Pomar Foundation,2010,Northeast,Phillips,Phillips County,5000.00,Holyoke,Capital,Children and Youth Services,El Pomar Foundation,2010,Northeast,Yuma,City of Wray,25000.00,Wray,Capital,"Community, Public Affairs",El Pomar Foundation,2010,Northeast,Yuma,Idalia Vision Foundation,5000.00,Idalia,Capital,Human Services,El Pomar Foundation,2010,Northeast,Yuma,"Wray Area Foundation, Inc.",5000.00,Wray,Program,"Community, Public Affairs",El Pomar Foundation,2010,Northeast,Yuma,Rural Communities Resource Center,7000.00,Yuma,Program,"Domestic Violence Shelters, Services",El Pomar Foundation,2010,Northeast,Yuma,Rural Communities Resource Center,3000.00,Yuma,Program,Children and Youth Services,El Pomar Foundation,2010,Northeast,Yuma,Rural Communities Resource Center,4800.00,Yuma,Program,Health                                                                     ,El Pomar Foundation,2010,Northeast,Yuma,Idalia High School,5000.00,Idalia,Other,Education,El Pomar Foundation,2010,Northeast,Yuma,Wray High School,5000.00,Wray,Other,Education,El Pomar Foundation,2010,Northwest,Grand,Advocates Victim Assistance Team,5000.00,Hot Sulphur Springs,General Operating,"Domestic Violence Shelters, Services",El Pomar Foundation,2010,Northwest,Moffat,Yampa Valley Partners,10000.00,Craig,General Operating,"Community, Public Affairs",El Pomar Foundation,2010,Northwest,Moffat,Love Inc of the Yampa Valley,5000.00,Craig,Program,Human Services,El Pomar Foundation,2010,Northwest,Moffat,Advocates Crisis Support Services,10000.00,Craig,Program,"Domestic Violence Shelters, Services",El Pomar Foundation,2010,Northwest,Moffat,Boys and Girls Club of Craig,2500.00,Craig,Program,Children and Youth Services,El Pomar Foundation,2010,Northwest,Moffat,Memorial Hospital of Craig Foundation,1500.00,Craig,General Operating,Health                                                                     ,El Pomar Foundation,2010,Northwest,Rio Blanco,Human Resources Centeer,1500.00,Rangely,General Operating,"Community, Public Affairs",El Pomar Foundation,2010,Northwest,Routt,North Routt Preschool,5000.00,Clark,General Operating,Education,El Pomar Foundation,2010,Northwest,Routt,Yampa Valley Medical Center,35000.00,Steamboat Springs,Other,Health                                                                     ,El Pomar Foundation,2010,Northwest,Routt,Lift-Up of Routt County,5000.00,Steamboat Springs,Program,Emergency Assistance      ,El Pomar Foundation,2010,Northwest,Routt,Advocates Against Battering and Abuse dba Advocates Building Peaceful Communities,10000.00,Steamboat Springs,Program,"Domestic Violence Shelters, Services",El Pomar Foundation,2010,San Juan,Gunnison,Western State College Foundation,10000.00,Gunnison,General Operating,Education,El Pomar Foundation,2010,San Juan,Gunnison,"Gunnison Valley Animal Welfare League, Inc.",5000.00,Gunnison,General Operating,Animal Protection and Welfare,El Pomar Foundation,2010,San Juan,Gunnison,Gunnison Country Food Pantry,5000.00,Gunnison,Program,Human Services,El Pomar Foundation,2010,San Juan,Gunnison,Gunnison County Health and Human Services,2500.00,Gunnison,Program,Health                                                                     ,El Pomar Foundation,2010,San Juan,Gunnison,"Jubilee House of Gunnison County, Inc.",3000.00,Gunnison,Program,"Domestic Violence Shelters, Services",El Pomar Foundation,2010,San Juan,Gunnison,Gunnison Country Partners,3000.00,Gunnison,Program,Children and Youth Services,El Pomar Foundation,2010,San Juan,Gunnison,Gunnison Council for the Arts,1500.00,Gunnison,General Operating,"Arts, Culture & Humanities ",El Pomar Foundation,2010,San Juan,Gunnison,Gunnison County Health and Human Services,10000.00,Gunnison,Program,Health                                                                     ,El Pomar Foundation,2010,San Juan,Hinsdale,Lake Fork Health Services District,25000.00,Lake City,Capital,Health                                                                     ,El Pomar Foundation,2010,San Juan,Hinsdale,Christian Community Service,5000.00,Lake City,Program,Human Services,El Pomar Foundation,2010,San Juan,Hinsdale,Lake City Arts Council,1500.00,Lake City,General Operating,"Arts, Culture & Humanities ",El Pomar Foundation,2010,San Juan,Montrose,Rimrocker Historical Society of Western Colorado,1500.00,Nucla,Other,"Arts, Culture & Humanities ",El Pomar Foundation,2010,San Juan,Montrose,Christ's Kitchen,2500.00,Montrose,General Operating,Human Services,El Pomar Foundation,2010,San Juan,Montrose,Dream Catcher Therapy Center,2500.00,Olathe,Program,Animal Protection and Welfare,El Pomar Foundation,2010,San Juan,Montrose,"Association of Montrose Churches, Inc.",8000.00,Montrose,Program,"Housing, Homeless shelters",El Pomar Foundation,2010,San Juan,Montrose,Hilltop Health Services Corporation,5000.00,Montrose,Program,"Domestic Violence Shelters, Services",El Pomar Foundation,2010,San Juan,Montrose,"Montrose County Senior Citizens Transportation, Inc.",3000.00,Montrose,Program,Disabled Persons,El Pomar Foundation,2010,San Juan,Montrose,"Montrose Medical Mission, Inc.",2500.00,Montrose,Program,Health                                                                     ,El Pomar Foundation,2010,San Juan,Montrose,"Sharing Ministries, Inc",3000.00,Montrose,Program,Human Services,El Pomar Foundation,2010,San Juan,Montrose,Black Canyon Boys & Girls Club,5000.00,Montrose,General Operating,Children and Youth Services,El Pomar Foundation,2010,San Juan,Montrose,Montrose County Health and Human Services,1500.00,Montrose,Program,Children and Youth Services,El Pomar Foundation,2010,San Juan,Ouray,Weehawken Creative Arts (WCA),2500.00,Ridgway,General Operating,"Arts, Culture & Humanities ",El Pomar Foundation,2010,San Juan,Ouray,Animal Humane Society of Ouray County,5000.00,Ridgway,Program,Animal Protection and Welfare,El Pomar Foundation,2010,San Juan,Ouray,United Church of the San Juans,1500.00,Ouray,Program,Human Services,El Pomar Foundation,2010,San Juan,San Miguel,Ah Haa School for the Arts,10000.00,Telluride,General Operating,Education,El Pomar Foundation,2010,San Juan,San Miguel,"University Centers of the San Miguel, Inc.",5000.00,Telluride,General Operating,Education,El Pomar Foundation,2010,San Juan,San Miguel,Telluride Medical Center Foundation,25000.00,Telluride,Capital,Health                                                                     ,El Pomar Foundation,2010,San Juan,San Miguel,San Miguel Mentoring Program,5000.00,Telluride,General Operating,"Community, Public Affairs",El Pomar Foundation,2010,San Juan,San Miguel,"Angel Baskets, Inc.",5000.00,Norwood,Program,Human Services,El Pomar Foundation,2010,San Juan,San Miguel,San Miguel Resource Center,2000.00,Telluride,Program,"Domestic Violence Shelters, Services",El Pomar Foundation,2010,San Juan,San Miguel,Telluride Foundation,5000.00,Telluride,Program,"Community, Public Affairs",El Pomar Foundation,2010,San Juan,San Miguel,Bright Futures,30000.00,Telluride,Other,Children and Youth Services,El Pomar Foundation,2010,San Juan,San Miguel,Telluride Foundation,35000.00,Telluride,Program,Health                                                                     ,El Pomar Foundation,2010,San Juan,San Miguel,Wright Stuff Community Foundation,1500.00,Norwood,Program,"Community, Public Affairs",El Pomar Foundation,2010,San Juan,San Miguel,Telluride High School,5000.00,Telluride,Other,Education,El Pomar Foundation,2010,San Luis Valley,Alamosa,San Luis Valley Museum,10000.00,Alamosa,Capital,"Arts, Culture & Humanities ",El Pomar Foundation,2010,San Luis Valley,Alamosa,Adams State College,25000.00,Alamosa,Other,Education,El Pomar Foundation,2010,San Luis Valley,Alamosa,"La Puente Home, Inc.",25000.00,Alamosa,Capital,"Housing, Homeless shelters",El Pomar Foundation,2010,San Luis Valley,Alamosa,"Tu Casa, Inc.",7500.00,Alamosa,Capital,"Domestic Violence Shelters, Services",El Pomar Foundation,2010,San Luis Valley,Alamosa,Alamosa County Health Department,8000.00,Alamosa,Program,"Domestic Violence Shelters, Services",El Pomar Foundation,2010,San Luis Valley,Alamosa,"South-Central Colorado Seniors, Inc",15000.00,Alamosa,Program,Health                                                                     ,El Pomar Foundation,2010,San Luis Valley,Alamosa,"Tu Casa, Inc.",9000.00,Alamosa,Program,"Domestic Violence Shelters, Services",El Pomar Foundation,2010,San Luis Valley,Alamosa,"Valley-Wide Health Services, Inc.",10000.00,Alamosa,Other,Health                                                                     ,El Pomar Foundation,2010,San Luis Valley,Alamosa,Adams State College Foundation,1500.00,Alamosa,Program,Education,El Pomar Foundation,2010,San Luis Valley,Alamosa,"Alamosa Community Greenhouse, Inc.",1500.00,Alamosa,Program,Education,El Pomar Foundation,2010,San Luis Valley,Alamosa,Alamosa Live Music Association,10000.00,Alamosa,Event,"Arts, Culture & Humanities ",El Pomar Foundation,2010,San Luis Valley,Alamosa,Boys and Girls Clubs of the San Luis Valley Inc.,2300.00,Alamosa,General Operating,Children and Youth Services,El Pomar Foundation,2010,San Luis Valley,Alamosa,Center for Restorative Programs,1500.00,Alamosa,General Operating,,El Pomar Foundation,2010,San Luis Valley,Alamosa,Friends of the Southern Peaks Library,3000.00,Alamosa,Program,Education,El Pomar Foundation,2010,San Luis Valley,Alamosa,"La Puente Home, Inc.",1500.00,Alamosa,Program,Human Services,El Pomar Foundation,2010,San Luis Valley,Alamosa,San Luis Valley Ecosystem Council,1000.00,Alamosa,Other,"Environment, Conservation",El Pomar Foundation,2010,San Luis Valley,Alamosa,San Luis Valley Habitat for Humanity,1800.00,Alamosa,Program,"Housing, Homeless shelters",El Pomar Foundation,2010,San Luis Valley,Alamosa,"San Luis Valley Regional Science Fair, Inc.",2200.00,Alamosa,General Operating,Education,El Pomar Foundation,2010,San Luis Valley,Alamosa,"South-Central Colorado Seniors, Inc",1500.00,Alamosa,Program,Human Services,El Pomar Foundation,2010,San Luis Valley,Alamosa,Valley Community Funds,1500.00,Alamosa,General Operating,"Community, Public Affairs",El Pomar Foundation,2010,San Luis Valley,Alamosa,Veterans Green Job Alliance,2500.00,Alamosa,General Operating,"Employment, Job training",El Pomar Foundation,2010,San Luis Valley,Conejos,Con-Cepts,2000.00,Conejos,General Operating,,El Pomar Foundation,2010,San Luis Valley,Conejos,Conejos County Library,10000.00,La Jara,Other,"Community, Public Affairs",El Pomar Foundation,2010,San Luis Valley,Conejos,Conejos County Tourism Council,7500.00,Antonito,Other,"Community, Public Affairs",El Pomar Foundation,2010,San Luis Valley,Conejos,La Jara Elementary Parent-Teacher Association,17500.00,La Jara,Other,Education,El Pomar Foundation,2010,San Luis Valley,Conejos,Valle del Sol Community Center,1500.00,Capulin,General Operating,"Community, Public Affairs",El Pomar Foundation,2010,San Luis Valley,Conejos,Centauri High School,5000.00,La Jara,Other,Education,El Pomar Foundation,2010,San Luis Valley,Costilla,Sierra Grande High School,5000.00,Blanca,Other,Education,El Pomar Foundation,2010,San Luis Valley,Mineral,Mineral County,10000.00,Creede,Program,Health                                                                     ,El Pomar Foundation,2010,San Luis Valley,Mineral,Creede Repertory Theatre,2500.00,Creede,Other,"Arts, Culture & Humanities ",El Pomar Foundation,2010,San Luis Valley,Mineral,"Mineral County Fairgrounds Association, Inc.",25000.00,Creede,Program,"Community, Public Affairs",El Pomar Foundation,2010,San Luis Valley,Rio Grande,Rio Grande County Library District,15500.00,Rio Grande,Capital,"Community, Public Affairs",El Pomar Foundation,2010,San Luis Valley,Rio Grande,Center Consolidated School District,22000.00,Center,Program,Education,El Pomar Foundation,2010,San Luis Valley,Rio Grande,City of Monte Vista,2500.00,Monte Vista,Program,Children and Youth Services,El Pomar Foundation,2010,San Luis Valley,Rio Grande,Homelake Historic Preservation and Restoration Foundation,2000.00,Homelake,Other,"Arts, Culture & Humanities ",El Pomar Foundation,2010,San Luis Valley,Rio Grande,Town of South Fork,3900.00,South Fork,Program,"Community, Public Affairs",El Pomar Foundation,2010,San Luis Valley,Saguache,Town of Crestone,10000.00,Crestone,Capital,"Community, Public Affairs",El Pomar Foundation,2010,San Luis Valley,Saguache,City of Cripple Creek Fire Department,1500.00,Cripple Creek,Other,"Public safety, Emergency relief",El Pomar Foundation,2010,San Luis Valley,Saguache,"Crestone Performances, Inc.",1500.00,Crestone,Other,"Arts, Culture & Humanities ",El Pomar Foundation,2010,San Luis Valley,Saguache,Town of Saguache,5000.00,Saguache,Capital,"Community, Public Affairs",El Pomar Foundation,2010,Southeast,Bent,Bent County Library District- Las Animas,10000.00,Las Animas,Capital,"Community, Public Affairs",El Pomar Foundation,2010,Southeast,Bent,Las Animas Helping Hands,7500.00,Las Animas,General Operating,Human Services,El Pomar Foundation,2010,Southeast,Bent,Las Animas Helping Hands,10000.00,Las Animas,Program,Human Services,El Pomar Foundation,2010,Southeast,Bent,Colorado Future Farmers of America Foundation,2500.00,Hasty,General Operating,"Community, Public Affairs",El Pomar Foundation,2010,Southeast,Bent,Las Animas-Bent County Library Distric,1500.00,Las Animas,General Operating,"Community, Public Affairs",El Pomar Foundation,2010,Southeast,Bent,Las Animas High School,5000.00,Las Animas,Other,Education,El Pomar Foundation,2010,Southeast,Crowley,Salvation Army Pueblo Corps and Community Center,3000.00,Ordway,Program,Human Services,El Pomar Foundation,2010,Southeast,Crowley,Crowley County Elementary,2500.00,Ordway,Program,Children and Youth Services,El Pomar Foundation,2010,Southeast,Huerfano,La Veta School of the Arts,1500.00,La Veta,Program,"Arts, Culture & Humanities ",El Pomar Foundation,2010,Southeast,Huerfano,Spanish Peaks Arts Council,10000.00,La Veta,Capital,"Arts, Culture & Humanities ",El Pomar Foundation,2010,Southeast,Huerfano,Friends of Spanish Peaks Library District,7500.00,Walsenburg,General Operating,"Community, Public Affairs",El Pomar Foundation,2010,Southeast,Huerfano,John Mall Jr/Sr High School,5000.00,Walsenburg,Other,Education,El Pomar Foundation,2010,Southeast,Huerfano,La Veta High School,5000.00,La Veta,Other,Education,El Pomar Foundation,2010,Southeast,Las Animas,Southern Colorado Repertory Theater,5000.00,Trinidad,General Operating,"Arts, Culture & Humanities ",El Pomar Foundation,2010,Southeast,Las Animas,Trinidad Community Foundation,2500.00,Trinidad,Program,"Community, Public Affairs",El Pomar Foundation,2010,Southeast,Las Animas,Trinidad Community Foundation,2500.00,Trinidad,Program,Education,El Pomar Foundation,2010,Southeast,Las Animas,Advocates Against Domestic Assault,5000.00,Trinidad,General Operating,"Domestic Violence Shelters, Services",El Pomar Foundation,2010,Southeast,Las Animas,Advocates Against Domestic Assault,3000.00,Trinidad,Program,"Domestic Violence Shelters, Services",El Pomar Foundation,2010,Southeast,Las Animas,"Crossroads Turning Points, Inc.",2500.00,Trinidad,Program,Health                                                                     ,El Pomar Foundation,2010,Southeast,Otero,Arkansas Valley Resource Center,10000.00,La Junta,Other,Human Services,El Pomar Foundation,2010,Southeast,Otero,Arkansas Valley Resource Center,2000.00,La Junta,General Operating,Human Services,El Pomar Foundation,2010,Southeast,Otero,"La Junta Associated Chanties, Inc",10000.00,La Junta,Program,Human Services,El Pomar Foundation,2010,Southeast,Otero,"Arkansas Valley Hospirce, Inc.",7500.00,La Junta,General Operating,Hospice,El Pomar Foundation,2010,Southeast,Otero,Southeast Mental Health Services,7500.00,La Junta,General Operating,Health                                                                     ,El Pomar Foundation,2010,Southeast,Otero,"Grand Friends, Inc. dba Rocky Ford Grand Theater",15000.00,Rocky Ford,General Operating,"Arts, Culture & Humanities ",El Pomar Foundation,2010,Southeast,Otero,"La Junta Associated Chanties, Inc",5000.00,La Junta,Program,Human Services,El Pomar Foundation,2010,Southeast,Otero,"Koshare Indian Museum, Inc",25000.00,La Junta,Other,"Arts, Culture & Humanities ",El Pomar Foundation,2010,Southeast,Otero,La Junta Middle School,3000.00,La Junta,Other,Education,El Pomar Foundation,2010,Southeast,Otero,La Junta Middle School,1500.00,La Junta,General Operating,Education,El Pomar Foundation,2010,Southeast,Otero,Fowler High School,5000.00,Fowler,Other,Education,El Pomar Foundation,2010,Southeast,Otero,La Junta High School,5000.00,La Junta,Other,Education,El Pomar Foundation,2010,Southeast,Otero,Manzanola High School,5000.00,Manzanola,Other,Education,El Pomar Foundation,2010,Southeast,Otero,Swink High School,5000.00,Swink,Other,Education,El Pomar Foundation,2010,Southeast,Prowers,Southeastern Colorado Homeless Center,5000.00,Lamar,Program,Human Services,El Pomar Foundation,2010,Southwest,Archuleta,Colorado Mounted Rangers Troop F,1500.00,Pagosa Springs,General Operating,"Community, Public Affairs",El Pomar Foundation,2010,Southwest,Archuleta,Humane Society of Pagosa Springs,3500.00,Pagosa Springs,Program,Animal Protection and Welfare,El Pomar Foundation,2010,Southwest,Archuleta,"Lucky Dog, Inc.",2000.00,Arboles,Capital,Animal Protection and Welfare,El Pomar Foundation,2010,Southwest,Archuleta,"Archuleta County Victims Assistance Program, Inc.",5000.00,Pagosa Springs,Program,"Domestic Violence Shelters, Services",El Pomar Foundation,2010,Southwest,Archuleta,Community United Methodist Church,2500.00,Pagosa Springs,Program,Human Services,El Pomar Foundation,2010,Southwest,Archuleta,Fisher's Peak Community Church,3000.00,Trinidad,Program,Human Services,El Pomar Foundation,2010,Southwest,Archuleta,Huerfano Las Animas Area Council of Governments,5000.00,Trinidad,Program,Human Services,El Pomar Foundation,2010,Southwest,Archuleta,Archuleta County Education Center,4000.00,Pagosa Springs,Program,Children and Youth Services,El Pomar Foundation,2010,Southwest,Archuleta,Community United Methodist Church,1500.00,Pagosa Springs,Program,Human Services,El Pomar Foundation,2010,Southwest,Dolores,Dove Creek High School,5000.00,Dove Creek,Program,Education,El Pomar Foundation,2010,Southwest,Dolores,Dolores County Health Association,5000.00,Dove Creek,Program,Human Services,El Pomar Foundation,2010,Southwest,Dolores,Dolores County Senior Services,5000.00,Cahone,Program,Human Services,El Pomar Foundation,2010,Southwest,Dolores,Dolores County Foundation,1500.00,Dove Creek,General Operating,"Community, Public Affairs",El Pomar Foundation,2010,Southwest,La Plata,Durango Discovery Museum,25000.00,Durango,Capital,"Arts, Culture & Humanities ",El Pomar Foundation,2010,Southwest,La Plata,Music in the Mountains,2500.00,Durango,General Operating,"Arts, Culture & Humanities ",